<?xml version="1.0" encoding="UTF-8"?>
<xs:schema xmlns:xs="http://www.w3.org/2001/XMLSchema">
  <xs:element name="biblioteca">
    <xs:complexType>
      <xs:sequence>
        <xs:element name="libro" maxOccurs="unbounded" minOccurs="1">
          <xs:complexType>
            <xs:sequence>
              <xs:element name="titulo" type="xs:string" />
              <xs:element name="autor" type="xs:string" />
              <xs:element name="editorial" type="xs:string" />
              <xs:element name="aÃ±o" type="xs:int" />
            </xs:sequence>
            <xs:attribute name="idioma" use="required" />
          </xs:complexType>
        </xs:element>
      </xs:sequence>
    </xs:complexType>
  </xs:element>
</xs:schema>