<?xml version="1.0"?>
<biblioteca xmlns:xsi="http://www.w3.org/2001/XMLSchema-instance"
 xsi:noNamespaceSchemaLocation="ejercicio_1_xsd.xsd">
  <libro idioma="es">
    <titulo>El Quijote</titulo>
    <autor>Cervantes</autor>
    <editorial>Alfaguara</editorial>
    <a単o>1605</a単o>
  </libro>
  <libro idioma="es">
    <titulo>El Quijote</titulo>
    <autor>Cervantes</autor>
    <editorial>Alfaguara</editorial>
    <a単o>1605</a単o>
  </libro>
</biblioteca>
